{
  "schemaVersion": "1.4.5",
  "title": "all the things",
  "description": "",
  "criteria": {
    "percentageCriterion": {
      "id": "percentageCriterion",
      "title": "percentages",
      "description": "description",
      "dataSources": [
        {
          "id": "ds1Id",
          "source": "ref",
          "sourceLink": "www.ref.com",
          "uncertainties": "uncertainty",
          "strengthOfEvidence": "strength",
          "unitOfMeasurement": {
            "type": "percentage",
            "label": "%"
          },
          "scale": [0, 100]
        }
      ]
    },
    "decimalCriterion": {
      "id": "decimalCriterion",
      "title": "decimals",
      "description": "description",
      "dataSources": [
        {
          "id": "ds2Id",
          "source": "ref",
          "sourceLink": "www.ref.com",
          "uncertainties": "uncertainty",
          "strengthOfEvidence": "strength",
          "unitOfMeasurement": {
            "type": "decimal",
            "label": ""
          },
          "scale": [0, 1]
        }
      ]
    },
    "customCriterion": {
      "id": "customCriterion",
      "title": "custom",
      "description": "description",
      "dataSources": [
        {
          "id": "ds3Id",
          "source": "ref",
          "sourceLink": "www.ref.com",
          "uncertainties": "uncertainty",
          "strengthOfEvidence": "strength",
          "unitOfMeasurement": {
            "type": "custom",
            "label": ""
          },
          "scale": [null, null]
        }
      ]
    }
  },
  "alternatives": {
    "alt1Id": {
      "id": "alt1Id",
      "title": "alt1"
    },
    "alt2Id": {
      "id": "alt2Id",
      "title": "alt2"
    },
    "alt3Id": {
      "id": "alt3Id",
      "title": "alt3"
    },
    "alt4Id": {
      "id": "alt4Id",
      "title": "alt4"
    },
    "alt5Id": {
      "id": "alt5Id",
      "title": "alt5"
    },
    "alt6Id": {
      "id": "alt6Id",
      "title": "alt6"
    },
    "alt7Id": {
      "id": "alt7Id",
      "title": "alt7"
    }
  },
  "performanceTable": [
    {
      "alternative": "alt1Id",
      "criterion": "percentageCriterion",
      "dataSource": "ds1Id",
      "performance": {
        "effect": {
          "type": "exact",
          "value": 0.01
        },
        "distribution": {
          "type": "dnorm",
          "parameters": {
            "mu": 0,
            "sigma": 0.005
          }
        }
      }
    },
    {
      "alternative": "alt2Id",
      "criterion": "percentageCriterion",
      "dataSource": "ds1Id",
      "performance": {
        "effect": {
          "type": "exact",
          "value": 0.01,
          "input": {
            "value": 1,
            "lowerBound": 0,
            "upperBound": 2
          }
        },
        "distribution": {
          "type": "dbeta",
          "parameters": {
            "alpha": 1,
            "beta": 5
          }
        }
      }
    },
    {
      "alternative": "alt3Id",
      "criterion": "percentageCriterion",
      "dataSource": "ds1Id",
      "performance": {
        "effect": {
          "type": "exact",
          "value": 0.455,
          "input": {
            "lowerBound": 1,
            "upperBound": 90
          }
        },
        "distribution": {
          "type": "dgamma",
          "parameters": {
            "alpha": 1,
            "beta": 5
          }
        }
      }
    },
    {
      "alternative": "alt4Id",
      "criterion": "percentageCriterion",
      "dataSource": "ds1Id",
      "performance": {
        "effect": {
          "type": "empty"
        },
        "distribution": {
          "type": "exact",
          "value": 0.01
        }
      }
    },
    {
      "alternative": "alt5Id",
      "criterion": "percentageCriterion",
      "dataSource": "ds1Id",
      "performance": {
        "effect": {
          "type": "empty",
          "value": "text me"
        },
        "distribution": {
          "type": "range",
          "parameters": {
            "lowerBound": 0,
            "upperBound": 0.9
          }
        }
      }
    },
    {
      "alternative": "alt6Id",
      "criterion": "percentageCriterion",
      "dataSource": "ds1Id",
      "performance": {
        "effect": {
          "type": "empty"
        },
        "distribution": {
          "type": "empty"
        }
      }
    },
    {
      "alternative": "alt7Id",
      "criterion": "percentageCriterion",
      "dataSource": "ds1Id",
      "performance": {
        "effect": {
          "type": "empty"
        },
        "distribution": {
          "type": "empty",
          "value": "text me"
        }
      }
    },
    {
      "alternative": "alt1Id",
      "criterion": "decimalCriterion",
      "dataSource": "ds2Id",
      "performance": {
        "effect": {
          "type": "exact",
          "value": 1
        },
        "distribution": {
          "type": "dnorm",
          "parameters": {
            "mu": 0,
            "sigma": 0.5
          }
        }
      }
    },
    {
      "alternative": "alt2Id",
      "criterion": "decimalCriterion",
      "dataSource": "ds2Id",
      "performance": {
        "effect": {
          "type": "exact",
          "value": 0.2,
          "input": {
            "value": 0.2,
            "lowerBound": 0.1,
            "upperBound": 0.5
          }
        },
        "distribution": {
          "type": "dbeta",
          "parameters": {
            "alpha": 1,
            "beta": 5
          }
        }
      }
    },
    {
      "alternative": "alt3Id",
      "criterion": "decimalCriterion",
      "dataSource": "ds2Id",
      "performance": {
        "effect": {
          "type": "exact",
          "value": 0.45,
          "input": {
            "lowerBound": 0,
            "upperBound": 0.9
          }
        },
        "distribution": {
          "type": "dgamma",
          "parameters": {
            "alpha": 1,
            "beta": 5
          }
        }
      }
    },
    {
      "alternative": "alt4Id",
      "criterion": "decimalCriterion",
      "dataSource": "ds2Id",
      "performance": {
        "effect": {
          "type": "empty"
        },
        "distribution": {
          "type": "exact",
          "value": 1
        }
      }
    },
    {
      "alternative": "alt5Id",
      "criterion": "decimalCriterion",
      "dataSource": "ds2Id",
      "performance": {
        "effect": {
          "type": "empty",
          "value": "text me"
        },
        "distribution": {
          "type": "range",
          "parameters": {
            "lowerBound": 0,
            "upperBound": 0.9
          }
        }
      }
    },
    {
      "alternative": "alt6Id",
      "criterion": "decimalCriterion",
      "dataSource": "ds2Id",
      "performance": {
        "effect": {
          "type": "empty"
        },
        "distribution": {
          "type": "empty"
        }
      }
    },
    {
      "alternative": "alt7Id",
      "criterion": "decimalCriterion",
      "dataSource": "ds2Id",
      "performance": {
        "effect": {
          "type": "empty"
        },
        "distribution": {
          "type": "empty",
          "value": "text me"
        }
      }
    },
    {
      "alternative": "alt1Id",
      "criterion": "customCriterion",
      "dataSource": "ds3Id",
      "performance": {
        "effect": {
          "type": "exact",
          "value": 1
        },
        "distribution": {
          "type": "dnorm",
          "parameters": {
            "mu": 0,
            "sigma": 0.5
          }
        }
      }
    },
    {
      "alternative": "alt2Id",
      "criterion": "customCriterion",
      "dataSource": "ds3Id",
      "performance": {
        "effect": {
          "type": "exact",
          "value": 1,
          "input": {
            "value": 1,
            "lowerBound": 0,
            "upperBound": 2
          }
        },
        "distribution": {
          "type": "dbeta",
          "parameters": {
            "alpha": 1,
            "beta": 5
          }
        }
      }
    },
    {
      "alternative": "alt3Id",
      "criterion": "customCriterion",
      "dataSource": "ds3Id",
      "performance": {
        "effect": {
          "type": "exact",
          "value": 45.5,
          "input": {
            "lowerBound": 1,
            "upperBound": 90
          }
        },
        "distribution": {
          "type": "dgamma",
          "parameters": {
            "alpha": 1,
            "beta": 5
          }
        }
      }
    },
    {
      "alternative": "alt4Id",
      "criterion": "customCriterion",
      "dataSource": "ds3Id",
      "performance": {
        "effect": {
          "type": "empty"
        },
        "distribution": {
          "type": "exact",
          "value": 1
        }
      }
    },
    {
      "alternative": "alt5Id",
      "criterion": "customCriterion",
      "dataSource": "ds3Id",
      "performance": {
        "effect": {
          "type": "empty",
          "value": "text me"
        },
        "distribution": {
          "type": "range",
          "parameters": {
            "lowerBound": 0,
            "upperBound": 90
          }
        }
      }
    },
    {
      "alternative": "alt6Id",
      "criterion": "customCriterion",
      "dataSource": "ds3Id",
      "performance": {
        "effect": {
          "type": "empty"
        },
        "distribution": {
          "type": "empty"
        }
      }
    },
    {
      "alternative": "alt7Id",
      "criterion": "customCriterion",
      "dataSource": "ds3Id",
      "performance": {
        "effect": {
          "type": "empty"
        },
        "distribution": {
          "type": "empty",
          "value": "text me"
        }
      }
    }
  ]
}
