{
  "schemaVersion": "1.4.5",
  "title": "only distributions",
  "description": "",
  "criteria": {
    "crit1": {
      "id": "crit1",
      "title": "criterion 1",
      "description": "",
      "dataSources": [
        {
          "id": "ds1",
          "source": "",
          "sourceLink": "",
          "uncertainties": "",
          "strengthOfEvidence": "",
          "unitOfMeasurement": {
            "type": "custom",
            "label": ""
          },
          "scale": [null, null]
        }
      ],
      "isFavorable": true
    },
    "crit2": {
      "id": "crit2",
      "title": "criterion 2",
      "description": "",
      "dataSources": [
        {
          "id": "ds2",
          "source": "",
          "sourceLink": "",
          "uncertainties": "",
          "strengthOfEvidence": "",
          "unitOfMeasurement": {
            "type": "custom",
            "label": ""
          },
          "scale": [null, null]
        }
      ],
      "isFavorable": true
    }
  },
  "alternatives": {
    "alt1": {
      "id": "alt1",
      "title": "alternative 1"
    },
    "alt2": {
      "id": "alt2",
      "title": "alternative 2"
    }
  },
  "performanceTable": [
    {
      "alternative": "alt1",
      "criterion": "crit1",
      "dataSource": "ds1",
      "performance": {
        "distribution": {
          "type": "dnorm",
          "parameters": {
            "mu": 0,
            "sigma": 0.5
          }
        }
      }
    },
    {
      "alternative": "alt2",
      "criterion": "crit1",
      "dataSource": "ds1",
      "performance": {
        "distribution": {
          "type": "dnorm",
          "parameters": {
            "mu": 1,
            "sigma": 0.5
          }
        }
      }
    },
    {
      "alternative": "alt1",
      "criterion": "crit2",
      "dataSource": "ds2",
      "performance": {
        "distribution": {
          "type": "dnorm",
          "parameters": {
            "mu": 2,
            "sigma": 0.5
          }
        }
      }
    },
    {
      "alternative": "alt2",
      "criterion": "crit2",
      "dataSource": "ds2",
      "performance": {
        "distribution": {
          "type": "dnorm",
          "parameters": {
            "mu": 3,
            "sigma": 0.5
          }
        }
      }
    }
  ]
}
