{
  "schemaVersion": "1.4.5",
  "title": "Test workspace",
  "criteria": {
    "c1": {
      "id": "c1",
      "title": "c1",
      "dataSources": [
        {
          "id": "ds1Id",
          "unitOfMeasurement": {
            "type": "custom",
            "label": ""
          },
          "scale": [null, null],
          "source": "ref1"
        }
      ]
    },
    "c2": {
      "id": "c2",
      "title": "c2",
      "dataSources": [
        {
          "id": "ds2Id",
          "unitOfMeasurement": {
            "type": "custom",
            "label": ""
          },
          "scale": [null, null],
          "source": "ref2"
        }
      ]
    }
  },
  "alternatives": {
    "a1": {
      "id": "a1",
      "title": "a1"
    },
    "a2": {
      "id": "a2",
      "title": "a2"
    }
  },
  "performanceTable": [
    {
      "alternative": "a1",
      "criterion": "c1",
      "dataSource": "ds1Id",
      "performance": {
        "effect": {
          "type": "exact",
          "value": 1
        }
      }
    },
    {
      "alternative": "a2",
      "criterion": "c1",
      "dataSource": "ds1Id",
      "performance": {
        "effect": {
          "type": "exact",
          "value": 2
        }
      }
    },
    {
      "alternative": "a1",
      "criterion": "c2",
      "dataSource": "ds2Id",
      "performance": {
        "effect": {
          "type": "exact",
          "value": 3
        }
      }
    },
    {
      "alternative": "a2",
      "criterion": "c2",
      "dataSource": "ds2Id",
      "performance": {
        "effect": {
          "type": "exact",
          "value": 4
        }
      }
    }
  ]
}
