{
  "schemaVersion": "1.4.5",
  "title": "Test workspace",
  "criteria": {
    "crit1Id": {
      "id": "crit1Id",
      "title": "c1",
      "dataSources": [
        {
          "id": "ds1Id",
          "scale": [null, null],
          "source": "ref1",
          "unitOfMeasurement": {
            "type": "custom",
            "label": ""
          }
        },
        {
          "id": "deselectionDataSourceId",
          "scale": [null, null],
          "source": "ref2",
          "unitOfMeasurement": {
            "type": "custom",
            "label": ""
          }
        }
      ]
    },
    "crit2Id": {
      "id": "crit2Id",
      "title": "c2",
      "dataSources": [
        {
          "id": "ds2Id",
          "scale": [null, null],
          "source": "ref3",
          "unitOfMeasurement": {
            "type": "custom",
            "label": ""
          }
        }
      ]
    },
    "deselectionCriterionId": {
      "id": "deselectionCriterionId",
      "title": "c3",
      "dataSources": [
        {
          "id": "ds3Id",
          "scale": [null, null],
          "source": "ref4",
          "unitOfMeasurement": {
            "type": "custom",
            "label": ""
          }
        }
      ]
    }
  },
  "alternatives": {
    "alt1Id": {
      "id": "alt1Id",
      "title": "a1"
    },
    "alt2Id": {
      "id": "alt2Id",
      "title": "a2"
    },
    "deselectionAlternativeId": {
      "id": "deselectionAlternativeId",
      "title": "a3"
    }
  },
  "performanceTable": [
    {
      "alternative": "alt1Id",
      "criterion": "crit1Id",
      "dataSource": "ds1Id",
      "performance": {
        "effect": {
          "type": "exact",
          "value": -100
        }
      }
    },
    {
      "alternative": "alt2Id",
      "criterion": "crit1Id",
      "dataSource": "ds1Id",
      "performance": {
        "effect": {
          "type": "exact",
          "value": 100
        }
      }
    },
    {
      "alternative": "deselectionAlternativeId",
      "criterion": "crit1Id",
      "dataSource": "ds1Id",
      "performance": {
        "effect": {
          "type": "exact",
          "value": 0
        }
      }
    },
    {
      "alternative": "alt1Id",
      "criterion": "crit1Id",
      "dataSource": "deselectionDataSourceId",
      "performance": {
        "effect": {
          "type": "exact",
          "value": 0
        }
      }
    },
    {
      "alternative": "alt2Id",
      "criterion": "crit1Id",
      "dataSource": "deselectionDataSourceId",
      "performance": {
        "effect": {
          "type": "empty"
        }
      }
    },
    {
      "alternative": "deselectionAlternativeId",
      "criterion": "crit1Id",
      "dataSource": "deselectionDataSourceId",
      "performance": {
        "effect": {
          "type": "exact",
          "value": 0
        }
      }
    },
    {
      "alternative": "alt1Id",
      "criterion": "crit2Id",
      "dataSource": "ds2Id",
      "performance": {
        "effect": {
          "type": "exact",
          "value": -50.5,
          "input": {
            "lowerBound": -101,
            "upperBound": 0
          }
        }
      }
    },
    {
      "alternative": "alt2Id",
      "criterion": "crit2Id",
      "dataSource": "ds2Id",
      "performance": {
        "effect": {
          "type": "exact",
          "value": 0,
          "input": {
            "value": 0,
            "lowerBound": -5,
            "upperBound": 6
          }
        }
      }
    },
    {
      "alternative": "deselectionAlternativeId",
      "criterion": "crit2Id",
      "dataSource": "ds2Id",
      "performance": {
        "effect": {
          "type": "exact",
          "value": 0
        }
      }
    },
    {
      "alternative": "alt1Id",
      "criterion": "deselectionCriterionId",
      "dataSource": "ds3Id",
      "performance": {
        "effect": {
          "type": "empty",
          "value": "text"
        }
      }
    },
    {
      "alternative": "alt2Id",
      "criterion": "deselectionCriterionId",
      "dataSource": "ds3Id",
      "performance": {
        "effect": {
          "type": "exact",
          "value": 0
        }
      }
    },
    {
      "alternative": "deselectionAlternativeId",
      "criterion": "deselectionCriterionId",
      "dataSource": "ds3Id",
      "performance": {
        "effect": {
          "type": "exact",
          "value": 0
        }
      }
    }
  ]
}
