{
  "title": "GetReal course LU 4, activity 4.4",
  "description": "Hypothetical new cancer treatment example.",
  "criteria": {
    "OS": {
      "id": "OS",
      "title": "2-year survival",
      "description": "Proportion of patients surviving for 2 years or longer",
      "dataSources": [
        {
          "pvf": {
            "range": [0.45, 0.65],
            "type": "linear",
            "direction": "increasing"
          },
          "scale": [0, 100],
          "id": "dsOS",
          "unitOfMeasurement": {
            "type": "percentage",
            "label": "%"
          }
        }
      ],
      "isFavorable": true
    },
    "severe": {
      "id": "severe",
      "title": "Severe toxicity",
      "description": "Proportion of patients experiencing severe side-effects",
      "dataSources": [
        {
          "pvf": {
            "range": [0, 0.8],
            "type": "linear",
            "direction": "decreasing"
          },
          "scale": [0, 100],
          "id": "dsSevere",
          "unitOfMeasurement": {
            "type": "percentage",
            "label": "%"
          }
        }
      ],
      "isFavorable": false
    },
    "moderate": {
      "id": "moderate",
      "title": "Moderate toxicity",
      "description": "Proportion of patients experiencing long-lasting moderate side-effects",
      "dataSources": [
        {
          "pvf": {
            "range": [0, 0.4],
            "type": "linear",
            "direction": "decreasing"
          },
          "scale": [0, 100],
          "id": "dsModerate",
          "unitOfMeasurement": {
            "type": "percentage",
            "label": "%"
          }
        }
      ],
      "isFavorable": false
    }
  },
  "alternatives": {
    "alt1": {
      "id": "alt1",
      "title": "New treatment"
    },
    "alt2": {
      "id": "alt2",
      "title": "Control"
    }
  },
  "performanceTable": [
    {
      "alternative": "alt1",
      "criterion": "OS",
      "performance": {
        "effect": {
          "type": "exact",
          "value": 0.6,
          "input": {
            "scale": "percentage",
            "value": 60
          }
        }
      },
      "dataSource": "dsOS"
    },
    {
      "alternative": "alt2",
      "criterion": "OS",
      "performance": {
        "effect": {
          "type": "exact",
          "value": 0.5,
          "input": {
            "scale": "percentage",
            "value": 50
          }
        }
      },
      "dataSource": "dsOS"
    },
    {
      "alternative": "alt1",
      "criterion": "severe",
      "performance": {
        "effect": {
          "type": "exact",
          "value": 0.6,
          "input": {
            "scale": "percentage",
            "value": 60
          }
        }
      },
      "dataSource": "dsSevere"
    },
    {
      "alternative": "alt2",
      "criterion": "severe",
      "performance": {
        "effect": {
          "type": "exact",
          "value": 0.2,
          "input": {
            "scale": "percentage",
            "value": 20
          }
        }
      },
      "dataSource": "dsSevere"
    },
    {
      "alternative": "alt1",
      "criterion": "moderate",
      "performance": {
        "effect": {
          "type": "exact",
          "value": 0.35,
          "input": {
            "scale": "percentage",
            "value": 35
          }
        }
      },
      "dataSource": "dsModerate"
    },
    {
      "alternative": "alt2",
      "criterion": "moderate",
      "performance": {
        "effect": {
          "type": "exact",
          "value": 0.05,
          "input": {
            "scale": "percentage",
            "value": 5
          }
        }
      },
      "dataSource": "dsModerate"
    }
  ],
  "schemaVersion": "1.4.5"
}
